Term,Source,Category,Definition,
Tidewater instability,IACS-UNESCO,Sea ice,"Unsteady, perhaps quasi-periodic, behaviour (Meier and Post 1987) of a tidewater glacier that undergoes alternating episodes of slow advance and rapid retreat. The conditions permitting advance to the advanced position in the first place, and the triggers for subsequent unstable retreat, are both poorly understood, although they may involve variations in basal water pressure and probably involve variations of the climatic mass balance. Once retreat has begun, however, observation and simulation (Schoof 2007) agree that, if the bed is grounded below sea level but has a slope opposed to that of the surface, the retreat will continue until the grounding line reaches a part of the bed that slopes in the same direction as the surface. During this unstable retreat, enhanced calving leads to a positive feedback in which accelerated flow and dynamic thinning extend far upglacier from the part that is grounded below sea level. Mass loss is far greater than, and essentially independent of, the climatic mass balance.",
toe,1-NSIDC,Glaciers,The lowest end of a glacier; also called glacier snout or terminus.,
Tongue,1-NSIDC,Freshwater ice,A projection of the ice edge up to several km in length caused by wind and current; usually forms when a valley glacier moves very quickly into a lake or ocean.,
Tongue activity ,GLIMS Manual,Glaciers,Uncertain: unknown or not measured; Marked retreat: more than 20 m per year retreat; Slight retreat: 20m per year retreat; Stationary: Stationary; Slight advance: 20m per year advance; Marked advance: more than 20m per year advancing; Possible surge: possible surge; Known surge: known surge; Oscillating: oscillating; Downwasting: stationary but rapidly losing mass through melting.,
"tongue, Floating ",IACS-UNESCO,Freshwater ice,"The terminal part of a glacier, the weight of which is partially or entirely supported by lake or seawater. Lateral stress from valley walls, and possibly from ice rises and other grounded parts of the glacier, supports a significant part of the weight of the floating ice, in which respect floating tongues generally differ from ice shelves.",
"tongue, Ice",AMS,Glaciers,"Any narrow extension of a glacier or ice shelf, such as a projection floating in the sea or an outlet glacier of an ice cap.",
Tuya,2-Molnia,Glaciers,"A volcano that erupted under a glacier. Because volcanic activity in western Canada was contemporaneous with the ebb and flow of Cordilleran glaciations, many of the volcanoes display ice contact features. Mount Garibaldi itself is a supraglacial volcano which erupted onto a regional ice sheet. Others, such as Hoodoo Mountain, were contained within basins thawed in the ice and assumed the flat-topped form of tuyas. Still others, such as the subglacial mounds of the Clearwater Field, were erupted under glacial ice to form piles of pillow lava and hyaloclastite.",
Unconformity,SwissEdu,Glaciers,"A discontinuity in the annual layering in firn or ice, resulting from a period when ablation cuts across successive layers.",