Term,Source,Category,Definition,
Group,GLIMS Manual,Glaciers,Neighbouring small glaciers; Slightly connected but too small to be treated separately; A number of similar small ice masses occurring in close proximity and too small to be assessed individually ,
Hypsometry,IACS-UNESCO,Glaciers,"The measurement of the distribution of glacier area with surface altitude (elevation), or more loosely the result of such measurement. Hypsometric and topographic data are essential for converting measurements of the mass-balance profile to glacier-wide estimates of the mass balance. Hypsography is a synonym. See area-altitude distribution, hypsometric curve.",
Ice bands,AMS,Glaciers,Ice layers formed by separate accumulation events and exposed at a glacier front or a crevasse wall.,
Ice bay,AMS,Ice Sheets and shelves,A baylike recess in the edge of a large ice floe or ice shelf. (Also called ice bight.) ,
Ice cap,1-NSIDC,Glaciers,"A dome-shaped mass of glacier ice that spreads out in all directions; an ice cap is usually larger than an icefield but less than 50,000 square-kilometers (12 million acres).",
"ice cap, Polar ",1-NSIDC,Glaciers,"A high-latitude region covered in ice; not a true ice cap, which are less than 50,000 square kilometers (12.4 million acres) and are always over land; more like an ice sheet; also called polar ice sheet.",
Ice cave,1-NSIDC,Glaciers,"A cave of ice, usually underneath a glacier and formed by meltwater; cave entrances are often enlarged near a glacier terminus by warm winds; most common on stagnant portions of glaciers.",
Ice cliff (ice wall),SwissEdu,Glaciers,"A vertical face of ice, normally formed where a glacier terminates in the sea, or is undercut by streams. These terms are also used more specifically for the face that forms at the seaward margin of an ice sheet or ice cap, and that rests on bedrock at or below sea level.",
Ice core,1-NSIDC,Snow,"A core sample drilled from the accumulation of snow and ice over many years that have recrystallized and have trapped air bubbles from previous time periods, the composition of which can be used to reconstruct past climates and climate change; typically removed from an ice sheet (Antarctica and Greenland) or from high mountain glaciers elsewhere.",
Ice covered,1-NSIDC,Glaciers,Land overlaid at present by a glacier is said to be covered; the alternative term glacierized has not found general favour.,
Ice crystal,AMS,Snow,"Any one of a number of macroscopic, crystalline forms in which ice appears, including hexagonal columns, hexagonal platelets, dendritic crystals, ice needles, and combinations of these forms.  The crystal lattice of ice is hexagonal in its symmetry under most atmospheric conditions. Varying conditions of temperature and vapor pressure can lead to growth of crystalline forms in which the simple hexagonal pattern is present in widely different habits (a thin hexagonal plate or a long thin hexagonal column). In many ice crystals, trigonal symmetry can be observed, suggesting an influence of a cubic symmetry. The principal axis (c axis) of a single crystal of ice is perpendicular to the axis of hexagonal symmetry. Planes perpendicular to this axis are called basal planes (a axes related to the prism facets) and present a hexagonal cross section. Ice is anisotropic in both its optical and electrical properties and has a high dielectric constant (even higher than water) resulting from its water dipole structure. The electrical relaxation time for water is much shorter than for ice (10^9 Hz compared with 10^4 Hz), resulting from a chain reaction requirement for molecules to relax through defects in the ice lattice. In the free air, ice crystals compose cirrus-type clouds, and near the ground they form the hydrometeor called, remarkably enough, ""ice crystals"" (or ice prisms). They are one constituent of ice fog, the other constituent being droxtals. On terrestrial objects the ice crystal is the elemental unit of hoarfrost in all of its various forms. Ice crystals that form in slightly supercooled water are termed frazil. Ice originating as frozen water (e.g., hail, graupel, and lake ice) still has hexagonal symmetry but lacks any external hexagonal form. Analysis of their sections (0.5 mm) in polarized light reveals different crystal shapes and orientations, depending on the freezing and any annealing and subsequent recrystallization process.",
Ice discharge,IACS-UNESCO,Glaciers,"Mass flux or volumetric flux of ice through a glacier cross section or 'gate'. The gate can be anywhere on the glacier, but is often at or close to the terminus. If the terminus is a calving front, ice discharge is usually in discrete pieces that, when discharged into a body of water, become icebergs, and the ice discharge is equivalent to the calving flux plus the flux due to advance (positive) or retreat (negative) of the calving front. Avalanching from the glacier margin, for example from the margin of a hanging glacier, may constitute ice discharge; see also dry calving.",
Ice divide,1-NSIDC,Glaciers,The boundary separating opposing flow directions of ice on a glacier or ice sheet.,
Ice equivalent,IACS-UNESCO,Snow,"A unit, in full the 'metre [of] ice equivalent', that is an extension of the SI for describing glacier mass in specific units as the thickness (in 'm ice eq.') Of an equal mass having the density of ice. Ice equivalents can be converted to kg m-2 by multiplying by the density of ice, and to water equivalents (m w. E.) By multiplying by the density of ice and dividing by the density of water (with sufficient accuracy, 1000 kg m-3).",
Ice field,2-Molnia,Snow,"A continuous accumulation of snow and glacier ice that completely fills a mountain basin or covers a low-relief mountain plateau to a substantial depth. When the thickness become great enough, tongues of ice overflow the basins or plateaus as Valley Glaciers.",
"ice field, Highland ",SwissEdu,Misc,"A near-continuous stretch of glacier ice, but with an irregular surface that follows approximately the contours of the underlying bedrock, and which is punctuated by nunataks (q.v.).",
Ice flow,AMS,Glaciers,"The motion of ice driven by gravitational forces (see glacier flow) or, for sea ice, wind and water currents.",
Ice front,1-NSIDC,Glaciers,"The vertical cliff forming the seaward face of an ice shelf or other floating glacier, varying in height from 2 to 50 meters (2.2 to 55 yards) above sea level.",
Ice gland,1-NSIDC,Snow,A column of ice in the granular snow at the top of a glacier.,
Ice layer,AMS,Snow,"An ice crust that has been covered by new snow.  When exposed at a glacier front or in crevasses, the ice layers viewed in cross section are termed ice bands.",
Ice piedmont,1-NSIDC,Ice Sheets and shelves,"Ice covering a costal strip of low-lying land backed by mountains; the surface of an ice piedmont slopes gently seawards and may be anything from 1 to 50 kilometers (0.6 to 31 miles) wide, fringing long stretches of coastline with ice cliffs; ice piedmonts frequently merge into ice shelves; a very narrow ice piedmont may be called an ice fringe.",
Ice plain,AMS,Ice Sheets and shelves,An area of slightly grounded ice in the mouth of some ice streams.  Typically an area of very low basal stress.,
Ice raft,AMS,Ice Sheets and shelves,A discrete block of slow-moving land ice that has been incorporated en masse into either an ice stream or an ice shelf.,
Ice rise,1-NSIDC,Ice Sheets and shelves,"A mass of ice resting on rock and surrounded either by an ice shelf, or partly by an ice shelf and partly by sea; no rock is exposed and there may be none above sea level; ice rises often have a dome-shaped surface; the largest known is about 100 kilometers (62 miles) across.",
Ice sheet,1-NSIDC,Glaciers,"A dome-shaped mass of glacier ice that covers surrounding terrain and is greater than 50,000 square kilometers (12 million acres) (e.g., the Greenland and Antarctic ice sheets).",
"ice sheet, Antarctic ",AMS,Ice Sheets and shelves,The continuous ice mass covering most of Antarctica.,
"ice sheet, Continental ",GLIMS Manual,Ice Sheets and shelves,"Unconstrained by topography Continental size Derive their morphological shape from ice flow properties, internal dynamics, and bedrock conditions Inundates areas of Continental size May incorporate individual ice domes",
"Ice Sheet, East Antarctic ",AMS,Ice Sheets and shelves,That portion of the Antarctic Ice Sheet lying predominantly in the Eastern Hemisphere.  A line following the Transantarctic Mountains to the Antarctic Peninsula serves as the boundary between the East and West Antarctic Ice Sheets.,
"Ice Sheet, Greenland",AMS,Ice sheets and shelves,"The contiguous ice sheet covering most of the Greenland subcontinent.  Strictly speaking, it does not also refer to the adjacent small ice caps and glaciers that are physically separated from the main ice mass.",
"ice sheet, Inland ",1-NSIDC,Ice Sheets and shelves,"An ice sheet of considerable thickness and an area of more than about 50,000 square kilometers (12.4 million acres), resting on rock; inland ice sheets near sea level may merge into ice shelves.",
"ice sheet, Marine-based ",IPCC WGI AR5 2013,Ice Sheets and shelves,An ice sheet containing a substantial region that rests on a bed lying below sea level and whose perimeter is in contact with the ocean. The best known example is the West Antarctic ice sheet.,
"Ice Sheet, West Antarctic ",AMS,Misc,That portion of the Antarctic Ice Sheet lying predominantly in the Western Hemisphere.  A line following the Transantarctic Mountains to the Antarctic Peninsula serves as the boundary between the East and West Antarctic Ice Sheets.,
Ice shelf,1-NSIDC,Ice Sheets and shelves,Portion of an ice sheet that spreads out over water.,
Ice shelf nourishing ,GLIMS Manual,Ice Sheets and shelves,Glaciers which are tributaries of an ice shelf. Approximate grounding line may be detectable. This class has been introduced due to the necessity for classifying glaciers which are tributaries of an ice shelf. ,
Ice stream,1-NSIDC,Glaciers,(1) a current of ice in an ice sheet or ice cap that flows faster than the surrounding ice (2) sometimes refers to the confluent sections of a branched-valley glacier (3) obsolete synonym of valley glaciers.,
Ice wall,1-NSIDC,Ice Sheets and shelves,"An ice cliff forming the seaward margin of an inland ice sheet, ice piedmont or ice rise; the rock basement may be at or below sea level.",
Internal deformation,SwissEdu,Glaciers,"The component of glacier flow that is the result of the deformation of glacier ice under the influence of accumulated snow and firn, and of gravity.",
Kinematic waves,2-Molnia,Glaciers,Refers to a wave of ice moving downglacier propagated by its increased thickness. The wave of ice may move at two to six times the velocity of surrounding thinner ice.,
Land ice,AMS,Ice general,"Any part of the earth's seasonal or perennial ice cover that has formed over land as the result, principally, of the freezing of precipitation; opposed to sea ice formed by the freezing of seawater.  Thus, an iceberg or tabular iceberg is land ice as well as its parent glacier, ice sheet, or ice shelf. The two major concentrations of land ice are the ice sheets of Greenland and Antarctica. Glaciers and ice caps are the other important forms.",
Lobe,PhysicalGeography.net,Glaciers,"A tongue-like extension of some material. For example, the ice lobe of an alpine glacier.",
Lobed,GLIMS Manual,Glaciers,"Initial stage of tongue formation (occurs on both micro and macro scales); In many cases part of an ice sheet, cap, field; Large or small scale radial ice margin; Is not an outlet or a valley glacier; If it terminates into sea, use class 'calving and lobed'; Part of an ice sheet or ice cap, disqualified as an outlet glacier (WGMS 1970, 1998); Tongue like form of an icefield or ice cap. (WGMS 1977) ",
margin,IACS-UNESCO,Glaciers,"The line separating the glacier from ice-free terrain. See divide, glacier outline, boundary, terminus.",
Marine ice,IACS-UNESCO,Ice Sheets and shelves,"Ice formed by the freezing of sea water at the base of an ice shelf. The formation of marine ice can contribute substantially to ice-shelf mass balance (see basal accumulation), and marine ice can be a substantial component of the ice shelf itself. See also accreted ice.",
Melt extent,IACS-UNESCO,Glaciers,"The spatial extent (dimension [L2]) of melting on the surface of the glacier. The melt extent can be measured by microwave remote sensing of the brightness temperature with a passive-microwave sensor, or equivalent analysis of radar or scatterometer imagery. The spatial resolution of passive-microwave radiometers and scatterometers being low at present (several km or coarser), the method is mainly exploited on ice sheets and large ice caps.",
Meltwater,IACS-UNESCO,Snow,"The liquid resulting from melting of ice, firn or snow.",
Meltwater conduit,1-NSIDC,Glaciers,"A channel within, underneath, on top of, or near the side of a glacier that drains meltwater out of the glacier; usually kept open by the frictional heating of flowing water that melts the ice walls of the conduit.",
Meltwater discharge,IACS-UNESCO,Snow,"The rate of flow through a cross section, usually a stream cross section, of water produced by melting of glacier ice, firn or snow that is removed from the glacier in surface, englacial or subglacial flows. See runoff. The measured discharge may include a contribution from rainfall on the glacier, and typically includes contributions from unglacierized parts of the drainage basin. Meltwater discharge is always reported as volume per unit time.",
Meltwater runoff,IACS-UNESCO,Snow,"The component of runoff (in sense 2) produced by melting of glacier ice, firn or snow that is removed in surface, englacial or subglacial flows. Meltwater runoff is not the same as surface ablation by melting, because surface meltwater may refreeze in the glacier (see refreezing, internal accumulation), and part of the meltwater runoff may originate from basal ablation or internal ablation. Nor is it usually the same as the total runoff, which is likely to include contributions from unglacierized parts of the drainage basin, and may include a contribution from rainfall on the glacier.",
Mid-range altitude,IACS-UNESCO,Glaciers,"The average of the minimum altitude and maximum altitude of the glacier. The mid-range altitude is of interest in itself as a measure of the vertical location of the glacier, but has also been shown to be (to within the accuracy of measurements) an unbiased estimator of the Balanced-budget ELA. See glaciation level.",
milk,SwissEdu,Freshwater ice,"Meltwater from a glacier, which commonly has a milky appearance from suspended fine sediment.",
Perfectly plastic solid,2-Molnia,Ice general,"A solid that does not deform until it reaches a critical value of stress, after which it will yield infinitely. Some glaciologists say that ice is a perfectly plastic substance. That is, brittle and capable of cracking like a solid, yet deformable and capable of flowing at other stresses.",
Proglacial,IACS-UNESCO,Glaciers,"Pertaining to an object in physical contact with, or close to, the glacier margin.",
Range,IACS-UNESCO,Glaciers,"(1) The distance to a target such as a glacier surface from an Active sensor such as a sonic ranger or a radar. (2) The cross-track coordinate in the coordinate frame of an airborne or orbiting radar. See azimuth. (3) Of an Active sensor, to measure the distance to, that is, to 'range to', a target. Senses 2 and 3 have evolved from sense 1, which originated in gunnery but has become common in several branches of remote sensing.",
Rapid dynamical change,IPCC WGI AR5 2013,Glaciers,"Changes in glacier or ice sheet mass controlled by changes in flow speed and discharge rather than by accumulation or ablation. This can result in a rate of mass change larger than that due to any imbalance between accumulation and ablation. Rapid dynamical change may be initiated by a climatic trigger, such as incursion of warm ocean water beneath an ice shelf, or thinning of a grounded tidewater terminus, which may lead to reactions within the glacier system, that may result in rapid ice loss. See also Mass balance/budget (of glaciers or ice sheets).",
Regelation,1-NSIDC,Glaciers,Motion of an object through ice by melting and freezing that is caused by pressure differences; this process allows a glacier to slide past small obstacles on its bed.,
Regelation ice,SwissEdu,Ice general,Ice which is formed from meltwater and basal debris as a result of changes of pressure beneath a glacier.,
remainie,1-NSIDC,Glaciers,"A glacier that is reconstructed or reconstituted out of other glacier material; usually formed by seracs falling from a hanging glacier, then re-adhering; also called reconstituted, reconstructed or regenerated glacier.",
Remnant,2-Molnia,Glaciers,"An isolated melting mass of glacier ice, that has become detached from its source and the remainder of the glacier. Some remnants cover many square miles.",
Rockslide,2-Molnia,Glaciers,"Several landslides generated by the Great Alaskan Earthquake, Good Friday 1964, fell onto the surface of the so-named glacierin the Chugach Mountains, Alaska.",
Run-out distance,SwissEdu,Glaciers,The distance an ice avalanche travels from its source.,
Runoff,IACS-UNESCO,Glaciers,"(1) Discharge of water divided by the area of the drainage basin contributing water to the measurement cross section, expressed in specific units such as mm w. E. D-1 or kg m-2 s-1. (2) The flux of water leaving the glacier. Sense 2 is common in mass-balance studies, especially in studies of ice-sheet mass balance. See mass-balance units; it is useful to have one word for total flux and a different word for specific flux, so the distinction between discharge and runoff is to be encouraged. Runoff includes meltwater discharge but also water from other sources than melt, such as rainfall.",
Runoff limit,IACS-UNESCO,Snow,"The altitude above which all rainfall and surface melt, if any, refreezes in the snow or firn, and below which part or all of it runs off the glacier. See zone.",
Sedimentary stratification,SwissEdu,Glaciers,The annual layering that forms from the build-up of snow in the accumulation area of a glacier. It is preserved in firn and sometimes in glacier ice.,
Shear zone,SwissEdu,Glaciers,"A zone of severe deformation, especially where a fast-flowing ice stream (q.v.) moves past relatively slow-moving ice. The deformation is characterised especially by intense crevassing.",
Shelf ice,IACS-UNESCO,Glaciers,"Ice forming part of an ice shelf, whether glacier ice, marine ice or ice originating from accumulation on the surface of the ice shelf.",
Shore ice,NOAA Hydro,Ice Sheets and shelves,An ice sheet in the form of a long border attached to the bank or shore; border ice.,
snout,1-NSIDC,Glaciers,The lowest end of a glacier; also called glacier terminus or toe.,
sole,1-NSIDC,Glaciers,The bottom of the ice of a glacier.,
Sorge's law,IACS-UNESCO,Snow,"The proposition that a glacier with a constant accumulation rate and no melting has a constant profile of density as a function of depth beneath the surface; by extension, and more loosely, the proposition that an unchanging density profile is sustained by the climatic mass balance. It follows from Sorge's law that a thickness change can be converted to an equivalent change of mass by multiplying by the density of glacier ice. This approach has been used in most mass-balancecalculations by geodetic methods. Sorge's law was originally introduced to describe densification of high polar snowpacks where melt is negligible. When Sorge's law is invoked in its looser sense, the constancy of the density profile is usually assumed rather than measured. The name, given by Bader (1954) in recognition of Ernst Sorge's observations in Greenland in 19301931, is pronounced as two syllables, the first stressed, with s as English z and with hard g.",
Stagnant ice,IACS-UNESCO,Glaciers,Any part of a glacier that does not flow at a detectable rate; a synonym of dead ice.,
Stagnation,2-Molnia,Glaciers,"The in-situ melting of glacier ice. Many glaciers have stagnant termini, covered by thick sediment debris. Some support vegetation, including mature forests.",
Strain,IACS-UNESCO 2009,Precipitation,The ratio of change in dimension to the original dimension. A material is said to be strained when a stress acting on it distorts it.,
Strand crack,1-NSIDC,Ice Sheets and shelves,"A fissure at the junction between an inland ice sheet, ice piedmont or ice rise and an ice shelf, the latter being subject to the rise and fall of the tide.",
Stratified drift,PhysicalGeography.net,Misc,A type of glacial drift that has been partially sorted by glaciofluvial meltwater.,
Subglacial,IACS-UNESCO,Glaciers,Pertaining to the glacier bed or to the material below the bed.,
Subglacial debris,SwissEdu,Glaciers,Debris which has been released from ice at the base of a glacier. Individual stones usually show signs of rounding as a result of abrasion at the contact between ice and bedrock.,
Subglacial meltwater channel,SwissEdu,Glaciers,"A steep, often vertically sided valley cut into bedrock by a subglacial stream under high pressure. It may have a profile with uphill sections, since a sufficient head in the glacier can force water to flow up slope.",
Subglacial permafrost,1-NSIDC,Glaciers,Permafrost beneath a glacier.,
Subglacial stream,SwissEdu,Glaciers,"A stream that flows beneath a glacier, and which usually cuts into the ice above to form a tunnel.",
Subglacial talik,1-NSIDC,Glaciers,A layer or body of unfrozen ground beneath a glacier in an area with permafrost.,
Submergence velocity,IACS-UNESCO,Glaciers,"The vertical component, when it is directed downward, of the glacier-flow velocity vector at the glacier surface, at a point fixed in space. When the component is directed upward, it is called the emergence velocity. The submergence velocity is related through the continuity equation to the climatic-basal mass balance and the rate of thickness change. The component is typically upward in the ablation zone and downward in the accumulation zone.",
Surge,2-Molnia,Glaciers,"A short-lived, frequently large-scale, increase in the rate of movement of the ice within a glacier. Ice velocities may increase 10 to 100 times above normal flow rates. In some surges, the terminus of a glacier rapidly advances. Although not all glaciers surge, those that do often surge with some sort of a periodicity.",
Surge front,SwissEdu,Glaciers,"The zone of intense compression between surging ice and non-surging ice. This is commonly marked by a bulge and a transition from heavily crevassed to crevasse-free ice. The surge front rapidly moves through the glacier, and if it reaches the snout, the glacier advances.",
Terminus,1-NSIDC,Glaciers,"The lowest end of a glacier, also called the glacier toe or glacier snout.",
Thickness,IACS-UNESCO,Snow,"The vertical distance between any two surfaces, and in particular between the glacier face and the summer surface, or the glacier surface and the bed. Glacier thickness is measured ideally by interpolating from a dense array of point measurements, constructed for example from ground-penetrating radar traverses. However the measurement density is often less than ideal, as when the array consists of a single traverse or even just a small number of boreholes. On most glaciers there are no thickness measurements at all and the thickness must be estimated, for example by volume-area scaling or as a function of surface slope and estimated basal shear stress. The definition of thickness as a vertical distance is adopted almost invariably in studies of mass balance, but not in all branches of cryospheric science. For example Fierz et al. (2009) define thickness as the coordinate normal to the slope, measured from the base of a layer of snow.",
Thickness change,IACS-UNESCO,Snow,"The change in the thickness of the glacier at a defined horizontal location. Thickness can change at a point due to ablation and accumulation at the surface and bottom of the glacier, compaction of snow and firn, or a non-zero emergence velocity or submergence velocity. Thickness change is often used interchangeably with elevation change, but the two are not necessarily the same. For example, elevation can change due to glacial isostatic adjustment or vertical tectonic motions, without a change in glacier thickness. The thickness change at a point is not equivalent to the climatic-basal mass balance at that point because the thickness change may be due in part to emergence or submergence. Thickness change at a point is therefore not a direct indicator of the local climate. The glacier-wide mean thickness change is the volume change of the entire glacier divided by the mean glacier area during the time span of the measurements: 2(h V VS S 21)/(21) , where V is volume, S is area, and subscripts 1 and 2 refer to measurements at an earlier and later time, respectively. The quantity 21( ) V V V is the volume change. Usually the two volumes are not known separately, and: V is obtained from measurements of by geodetic methods. The mean thickness change, if multiplied by the density of the mass gained or lost, is equal to the glacier-wide mass balance over the period of the thickness change. The mean thickness change differs from the change of mean thickness, which is V2/S2  V1/S1.",
Thomson crystal,1-NSIDC,Snow,"A large ice crystal found in deep, stagnant water-filled cavities of a glacier.",
Thrust,SwissEdu,Glaciers,"A low-angle fault, usually formed where the ice is under compression. Thrusts commonly extend from the bed and are associated with debris and overturned folds.",
